{
  "$schema": "https://json-schema.org/draft-07/schema#",
  "title": "Platform settings",
  "description": "Settings for the platform AI agent, its tools and the permission system. This file is generated — do not edit it by hand, change barpo-config/src/schema.ts instead.",
  "properties": {
    "$schema": {
      "type": "string"
    },
    "agent": {
      "type": "object",
      "properties": {
        "history": {
          "type": "object",
          "properties": {
            "maxMessages": {
              "description": "Maximum number of messages sent to the LLM. Older ones are dropped (compacted first if compaction is enabled).",
              "default": 200,
              "type": "number",
              "minimum": 10,
              "maximum": 5000
            },
            "toolResultLimit": {
              "description": "Maximum length (characters) of a single tool result stored in history, so long `read`/`bash` output does not swamp the context.",
              "default": 4000,
              "type": "number",
              "minimum": 200,
              "maximum": 100000
            }
          },
          "additionalProperties": false
        },
        "compaction": {
          "type": "object",
          "properties": {
            "enabled": {
              "description": "Automatically compact history when the context fills up. If disabled, a long conversation stops fitting in the context window.",
              "default": true,
              "type": "boolean"
            },
            "reserveTokens": {
              "description": "Part of the context window reserved for the summary prompt and the response. Compaction starts once the context exceeds (window - reserve).",
              "default": 16384,
              "type": "number",
              "minimum": 1000,
              "maximum": 200000
            },
            "keptTokens": {
              "description": "How much of the most recent context is kept verbatim after compaction. A larger value keeps recent history more precise but makes compaction less effective.",
              "default": 20000,
              "type": "number",
              "minimum": 1000,
              "maximum": 200000
            },
            "model": {
              "description": "Model used for compaction, as `provider/model`. When `null` the main chat model is used (summary quality matters, hence the default).",
              "default": null,
              "type": [
                "string",
                "null"
              ]
            }
          },
          "additionalProperties": false
        },
        "tools": {
          "type": "object",
          "properties": {
            "enabled": {
              "description": "Tools given to the agent. A tool removed from the list is invisible — the agent does not know it exists.",
              "default": [
                "read",
                "write",
                "edit",
                "bash",
                "grep",
                "find",
                "ls",
                "serverList",
                "appPublish",
                "appDelete",
                "scheduleCreate",
                "scheduleList",
                "scheduleDelete"
              ],
              "type": "array",
              "items": {
                "type": "string"
              }
            },
            "bashTimeoutSeconds": {
              "description": "Maximum run time for a single `bash` command. Waiting forever would freeze the web session.",
              "default": 120,
              "type": "number",
              "minimum": 1,
              "maximum": 3600
            },
            "resultLimit": {
              "description": "Maximum length (characters) of a tool result sent to the UI. The limit for what is stored in history is configured separately.",
              "default": 2000,
              "type": "number",
              "minimum": 200,
              "maximum": 50000
            }
          },
          "additionalProperties": false
        }
      },
      "additionalProperties": false
    },
    "permission": {
      "type": "object",
      "properties": {
        "mode": {
          "description": "Initial permission mode for a new session. `confirm` asks about every dangerous action; `auto` lets the classifier decide.",
          "default": "confirm",
          "type": "string",
          "enum": [
            "confirm",
            "auto"
          ]
        },
        "waitSeconds": {
          "description": "How long to wait for an answer to a permission request. On timeout the request is DENIED, so the agent does not hang forever.",
          "default": 300,
          "type": "number",
          "minimum": 10,
          "maximum": 3600
        },
        "classifierModel": {
          "description": "Model for the auto-mode classifier, as `provider/model`. When `null` it is chosen automatically FROM THE CHAT'S OWN PROVIDER — that one is known to be reachable and paid for, whereas the cheapest model overall may sit on a billing channel with no credit on it.",
          "default": null,
          "type": [
            "string",
            "null"
          ]
        },
        "consecutiveBlockLimit": {
          "description": "Auto mode turns off after the classifier blocks this many actions in a row — the agent may be going beyond what was asked.",
          "default": 3,
          "type": "number",
          "minimum": 1,
          "maximum": 100
        },
        "totalBlockLimit": {
          "description": "Auto mode turns off after this many blocks in total during a session.",
          "default": 20,
          "type": "number",
          "minimum": 1,
          "maximum": 1000
        },
        "extraDenyList": {
          "description": "Additional forbidden command names. They are ADDED to the built-in hard block list, never replace it — the security boundary cannot be lowered.",
          "default": [],
          "type": "array",
          "items": {
            "type": "string"
          }
        }
      },
      "additionalProperties": false
    },
    "session": {
      "type": "object",
      "properties": {
        "workDir": {
          "description": "Root directory the agent tools work in. When `null`, `~/.barpo/work/` is used.",
          "default": null,
          "type": [
            "string",
            "null"
          ]
        },
        "idleMinutes": {
          "description": "In-memory resources of a session idle for this long (permission state, mode) are cleaned up. The conversation history stays in the database.",
          "default": 60,
          "type": "number",
          "minimum": 1,
          "maximum": 10080
        }
      },
      "additionalProperties": false
    },
    "mcp": {
      "type": "object",
      "properties": {
        "connectTimeoutSeconds": {
          "description": "Maximum wait for the MCP server handshake. If the server does not respond the session continues — only that server is unavailable.",
          "default": 10,
          "type": "number",
          "minimum": 1,
          "maximum": 60
        },
        "callTimeoutSeconds": {
          "description": "Maximum wait for a single MCP tool call.",
          "default": 30,
          "type": "number",
          "minimum": 1,
          "maximum": 300
        }
      },
      "additionalProperties": false
    },
    "chat": {
      "type": "object",
      "properties": {
        "attachment": {
          "type": "object",
          "properties": {
            "maxFileMb": {
              "description": "Maximum size (MB) of a single file attached to a chat.",
              "default": 20,
              "type": "number",
              "minimum": 1,
              "maximum": 200
            },
            "maxCount": {
              "description": "Maximum number of files attached to a single message.",
              "default": 10,
              "type": "number",
              "minimum": 1,
              "maximum": 50
            }
          },
          "additionalProperties": false
        }
      },
      "additionalProperties": false
    }
  },
  "type": "object",
  "additionalProperties": false
}
